Essays,Grammar,Lexical,Global Organization,Local Organization,Supporting Ideas,Holistic
" As far as I am concerned, I advocate that government should be allowed to limit the number of children a family can have. Because nowadays with the development of society and medicine, our population become more and more larger all over the world. And if there are too many people in the world, there will be a lot of disasters. For example, too many people will consume too much resource in the earth, which may lead to the extinction of human beings. Whats more, too many people will make it harder for government to take care of its citizens when they are old. In the past few years, China had too many people to greed and government had to limit the number of children a family can have. I think this issue is pretty good and it certainly solve some problems caused by explosion of population.
 Some people may say that this governments issue does harm to peoples right because they believe that giving birth to a child is a persons basic right and nobody should make rules to limit the number of children. In terms of this opinion, I would like to say that having a child is surely a persons basic right, but if all the people in the world use this right limitlessly, then our planet will be full of people and our human beings will face the danger of extinction. So the government should take the responsibility to remove this phenomenon and control the population in order to the better future for our earth and our human beings.
 All in all, I believe that government should be allowed to limit the number of children a family can have.
",5,4.5,6.5,6,6,4
"I think a government should limit the number of children a family can have.
With the rapidly increasing number of population,the carrying capacity of environment is becoming worse and worse.The land ,the house ,the work position are all limited,so we cant assure that everyone will have a house to live in ,have food to eat,have working position to earn money no matter in nowadays or in the future.So if the population is still growing ,it will exceed the carring capacity.The comsuption of resources and energy is also a very serious phenomenon,people need food,need water ,need clothes to wear,they need many things that all coIme from the nature,with time going by and the growing population,the nature cant afford this finally.So that the case of ensuring the self sufficiency of the country's resources to ensure it meets the needs of the population is very important.
Although it is humans proper right to decide how many children they want to have , we should also consider about the advantages and disadvantages about having over two children.If a family is very poor,that having a child is most suitable.Because raising up a child need high expense and much energy,if they have a second,a third or more children ,they will not afford it and each childs life cant be happy too.So maybe having only one chilid is their best choice ,they can put their enough energy and money all on the child , and the baby is more likely to be a better and successful man in the future .
As we can see , China is a typical country of a large population , so I think the government should limit the number of children a family can have.
",4,5,5,4,5.5,3
"My view on limitation of the number of children
In the recent years, most of families face a realistic problem whether a family should nourish another child. However, the government make some policies to limit the number of children. Thus, a sharp argument occur.In my opinion, I support the part of government.Here are two my views about it.
For one thing, in our mind,its our rights to bring out our offspring that is independent from power. Of course,We should be ourselves and make birth decision by ourselves. That seems proper well. However, if right get away from any limits, its will be a disaster making by human. Except right of birth, human will over use other rights if there is no limit when we know we can do everything.So it is important to give a policy to astrict rights. For another thing, if we failed to control number of people due to no limitation of it, the earth would afford thousand of requirements to various resource and get worse until people cant survive in earth one day. The limited resources must march the proper number of people.Whats more, people cant occupy earth by ourselves.We are supposed to share the earth with all kinds of species. Not only animals but also botany are the host as us of earth. We have no right to expel them for our huge population.In this way, limiting number of children protect the equal right between all species and us human.
In conclusion, compared with different efforts of huge number population,we will discovery that for further development and sustaining the earths balance we should agree with government to limit the number of children.
",4.5,4.5,5.5,5.5,4.5,3
"As the time passing by and the social developing, more and more babies are born but less and less people go die. Therefore, the number of people increases rapidly now in all over the world. The large population start to become a burden on the earth.
   As far as I concerned, we must have a powerful institution to control the tendency and change the situation. For each country, their government should be allowed to limit the number of children a family can have. Just serious policy and puissant right can let everybody listen to. Most country is not developed enough, especially humans view. I guess half of them cant realize how dangerous crisis we meet at least. At once, we have no time to wait that they will change their own mind, but only change their behavior is adequate. Its useful and efficient.
   Of course, some guys may say this way will disobey basic human rights or broke people the idea of choice. The number of children a family can have is their personal thing, they should have the number whatever they want.
  On the one hand, I cant reject the reason, even I accept it exactly. On the other hand, I still have some words to speak at the same time. How many members in your family is not only your familys work, its also others work. The source is limited. The earth only can burden limited population. If we beyond the scope and break the natural rules, it just can be worse and worse until to the end. 
   There are a lot of successful practice in history. The truth often in the hands of a few. Dominators will do their best to govern our country.The rest of people dont need to have the same long range plan, they cant have though. Just accept and obey a new design. You may cant understand it right away. Nevertheless, when you discover its benefit, you will exclaim and smile in great surprise.
   In a word, I agree with the government control.
",4,4.5,5,4,4,3
"Should a government be allowed to limit the number of children a family can have? To be honest, at the time I saw this question,I felt a little shamed for myself.My major is law and I should have thought similar question in my own before.  
Overall, family planning is do the most effective way to solve the large population problem in China. Even though the government limited the number of children, a lot of people still are suffering from starvation and have a low standard of living.If we don't control the birth of each family, the problem of population will worse and worse.There is a severe phenomenon that sharp increasing in population of China, and people tend to get more and more old, but many of us didn't realize it, and still ignore the Family planning, especially rural areas.If we are not take steps to control the population,China can not to become a developed-country for a while. 
But on the other side, everyone has human rights which is the most important thing in the modern society.No matter if we want to give birth to a child and no matter how many children we want, it is our own choices which can't be limited by others.What's more, let me give just take one simple example.If government limit the number of children a family can have, once parents are old, they have only one child who can take care of them.It's a huge burden for both of parents and children.For the only child, he may feel lonely during his childhood because no brother or sister play with him.
In my opinion, family planning is indispensable in China.We can't ignore the huge population.Though human rights is important,I still think we can give up some our own benefit for the better future of our country.
",4,4,5,5,4.5,3
"A government  can be allowed to limit the number of children a family can have.

  China is a country with the largest population of the world,which means it have to contribute more  and manage more on population than other countries.In case that people here cant live a normal life that can eat enough,live happily.

  As we all know,recent years western countries are nearly facing a situation that the population is down.So they have carried out a series of policies to encourage the family to have more baby so that in the future the society will not be lack of labors.

  So when they stand at the highest point of the morality,who gives them the privilege?They claimed for many times that the Family planning of China is a kind of defense to human rights.It seems that the way to prevent more babies coming to this world is a cruel decision.So is it correct that you just let them come out even expect more?  How do you know the babies want to come out?
  
   What is human right?Is it just the right to allow a person to exist?After the birth,who can assure the living feeds and education?Who can give enough attention to their growth?Who can keep track of them and not give up each life in dilemma?
  
    At that time China gave limitation to the number of baby in each family because the economic was not that developed even can be said to be poor.But their last generation,were getting older.The young not only faced with supporting children but to support the old years later.To make people can live more easy at every time,the government chose this way .Though there were some faults the policy takers made,the policy eased the big pressure of the country and fastened its speed of developing.
",4,4,4,5,5,3
"Limit the number of child In China
The one-child policy, a part of the family planning policy, was a population planning policy of China. Although designated a ""temporary measure,"" it continues a quarter-century after its establishment. The policy limits couples to one child. Our country devoted to limit the number of child. Its history is a long way. During the period of Mao Zedong's leadership in China, Until the 1960s, the government encouraged families to have as many children as possible because of Mao's belief that population growth empowered the country. However, due to the rapid and powerful fertility in China. China has been the biggest population country, and With a population explosion, a series of other problems will emerge. There will be a lack of land, food supply, water, fuel and so on in our country. The population growth was unsustainable and there was a consensus that a birth limitation policy was necessary. The consequence of the problems will threaten human life.
Therefore, we measure the family planning policy to stop the harm. On the other hand, some realized that it not benefit to the human right. The procreation right is the basic right to the human being. It is also the significant point for people to choose one carrying the family on. At the same time, the next generation also have the obligation to service society and take care of olds. Onechild policy whether make this right impossible or not. Though, this doubt existed in many people who cant be accustomed to the new policy. One-child policy also give more chances to those lower living standard.
To me, we generation just the first onechild. Enjoy the benefit of policy also feel the disadvantage of it. Im afraid of parents love will be divided, but the hard obligation taking care of both olds and youth falls on me all. Fewer children and young people destroy the balance of this society. China is adapting of this circumstance that end to one-child policy and allow two. 

",4.5,6,5,6,5,3.5
"In my opinion, the government should limit the number of children a family can have. China has the largest number of people in the world. In most of cities, a couple only can one child, and in most of villages, one couple only can have two children. 
Our government has huge pressure to manage so many people, so it will lead to social chaos and a lot of unfair event. Moreover, the parents can provide good education environment to their own child and pay more attention to them. It can train more talent man for the society. The Family Planning Policy is a very good policy, especially in China, because China has turned into overpopulation trend. So, it is a very important and urgent to control the China population, and the Family Planning Policy is the best way.
Too many people make our country very crowded and dirty. We dont have enough resource to support so much people to live in a good life. We dont have more places for people to live. China has been the country which has the largest population for a long time. Based on the number of China, launching family planning policy helps to address the crowd of people in many cities especially in Beijing, Shanghai and Guangzhou. We should take some measures like limiting the number of children a family have. Only when our population maintains in a reasonable level can our country turn round peacefully.
Last but not the least, the aged trend of population may happen sometime in the future because people may live longer than before. Therefore, family planning policy enables a reasonable control of population ratio.
",4.5,5,5.5,5.5,5.5,3.5
"  While drawing up policies, governments always make decisions base on specific national conditions. Consequently, governments in countries which have large population always adopt policies to cut down the population. China is a typical country with a large population and adopted the family planning policy. 
  Actually government has no power to decide the number of children a family can have. On the one hand, people are born to pocess their human rights while the government has the duty to protect their rights. Based on the law of reproduction in biological community, it is obvious that the intervention of human administration in specific individual fertility is against the laws of nature. On the other hand, limiting the number of children may cause disasters for the human society. Over the past few decades, China has adopted the family planning policy to limit the large population. As a result, the problem of population explosion has been alleviated while the aging problem has been even worse. It did exert an bad influence and bring in fundamentally huge problems on the long-term development. 
  Although goverment has no coerceive power to limit the number of children, they have to take the responsibilities for the benifits of whole society. As the development of economy, population explosion has been an large problem for most developing countries. There is no doubt that the population explosion is cause of shortage of resourses. To slowing the population expansion, many country adopted policies to cut down population. However, such policies can never be the fundamental methods for it do harm to human rights. It is necessary for goerments to pay attention to improve population quality and change their minds in the deep heart. Only when people have the consciousness to deliever fewer babies and contribute to society, the problems on population will be solved. 
",6,7,6,6,6.5,4.5
"If a country wishes to develop well, the government must to consider fully, considering whether this policy will benefit the sustainable development of the whole society or not. One-child policy, as a special national policy, has been in China for a long time. This unique government behavior deeply affects the country and causes controversy constantly.
Should a government be allowed to limit the number of children a family can have?
My answer is that Chinese government should carry out the policy to keep the social stability during special period by its power.
  Most of people, who are opposed the limited children, hold the view that government seriously destroys basic human rights and it is unmoral. 
I want to argue with them. They just see the short benefits rather than long term. Obviously, they ignore the danger of population explosion. If every family give birth to children without limited, the number of people will rise to an unimaginable the high. The environment we live couldnt bear the pressure of such a large population. At the most basic level, people will not have enough food to eat, enough place to live and even not have enough water to drink. When survival cant be guaranteed, how do we talk about national development? If you think your basic rights are more important than the survival crisis of the whole country, please stop. Every policy of government is deliberate. At the period of productivity is lagging behind, the implementation of the family planning policy has improved the quality of life for most people in the whole society. 
This is the same reason that government releases the limit of birth now. For now, the economy and goods and many things are enough to support the policy. Our country also needs fresh popularity to support national construction.
An unwise idea couldnt lead the whole state to a long range development path. National policies should not be determined by outside influence. Sometimes, you should have overall awareness.
",6,6,6,5,6,4
"First of all, I should tell for certain, the government has a duty to limit the number of children a family can have. 
In other words, the government should carry out the population policy which including not only birth control, but also some supporting policies. Otherwise, we can see that there are some bad results of the one-child policy implemented to reduce the impact on humanity's over-consumption of resources in 1979, such as the falling birthrate, workforce shortages and aged tendency of population. So the time has come for the first big step: a switch to a two-child policy. 
I have to say a range of social problems have been resolved under government control, not only over-population, congestion, and pollution. There is no doubt that population policy have two sides.
But from the human rights point of view, no matter who has no right to disempower others to be parents. However, income, education and occupation are factors that affect people's idea of birth. Chinese traditional opinions of procreation affects society deeply. Decayed ones, for example, the attitude towards 'Bring up their children for old age' will bring heavy burden to the family and the society. The coercive powers of government will be working now. 
However, in the decision-making part, if a government will be able to work from a practical standpoint, if a government can have an insight into the society, if a governments policy will promote social progress, these bothers me a little bit. A scientific decision should be tested over time.
",5,6,4,4,5,3
"The one child policy has been carried out for over30 years, which was put forward to solve the intense increasing population. These days a new population policy was released to adapt the latest population situation. 
Actually, the population was well-controlled during these 30 years. According to the National Bureau of Statistics, the total fertility rate in China has been slow down, which means we are facing serious baby bust. At the same time, the elderly population surges quickly. Our process goes too fast that it caused many problems. So we need flexible policy to deal with the birth of the second child.  
Now parents of the first generation of the only-children are stepping into old age. China is entering a 4-2-1 Family era, four seniors, one couple, and one child, a perfect ""Inverted Pyramid"" model. In this bizarre 4-2-1 pattern, with parents above, and the only child below, the young generation is trapped in the middle layer, known as the generation of sandwich. Besides, once the seniors had an accident, the child may not be able to take care of them in time. And if the child had an accident such as Hurricane , it would be a total loss for the whole family and no one could take care of the family instead. 
In the new policy in many provinces, the couples who are both the only-child could have two children. It was a necessary amendment to reduce the heavy burdens of the family.  
One child policy was not suitable for all situations, for some special group of people, we need different flexible policy. As the new policy in Anhui and Jilin, for the couples who are both agricultural residents and their first child is a girl, they are permitted to have a second child. It can solve the problem of lacking in workforce in rural family. With poor economy and low development, they depend more on the number of labor in a family. 
",6,6,5,5,4.5,4
"From my perspective, government shouldnt be allowed to limit the number of children a family can have. First of all, deciding to have how many children is basic human right, its ridiculous to ask people not to have a child. So government cant force people not to have more than one child or something like that.
   Some people maybe worry about population explosion. In my opinion, of course, population explosion will definitely have bad influence on environment and cause lack of resources. But you cant say not limiting the number of children a family can have will cause population explosion. Considering the huge amount of population of China and its rapid increasing speed, our government made a law about one-child limit in 90s, which was a wise decision at that time in some way. 
   However, its different today. Our country development is rapid, and we have already encountered aging problem mainly due to the one-child policy. Even if one-child policy doesnt exist now, the government doesnt need to worry about the population explosion. Because as far as I know, the notion about having children has changed. Nowadays, having many children is old school. People care much more about the quality of life, so couple will take their ability of adapting a child into consideration seriously before they decide to have a baby.
",4,5,5,5,4.5,3
"In my opinion, I think different regional governments should adopt different policies. China, for example, has a huge population of 1.3 billion. If the government does not control the number of children, every family will also increase in the number of Chinese population, this will bring a lot of problems, such as traffic jam, housing problems and shortage of resources and many other problems. Is the most important is the children's education problem, China is currently facing a shortage of education resources and distribution of the situation, if we do not limit the population, so their children to school will become a big problem, the resulting low population quality, social and moral issues. Only if the Chinese government controls the number of children per family and keeps the Chinese population stable can we reduce these problems and promote China's development. A government decision should take into account the needs of its own country, so the Chinese government should limit the number of children a family has. In Russia, however, Russia is sparsely populated, leaving the workforce in short supply. It takes a lot of human resources to build the country and promote the development of the country. So the government should encourage fertility, not limit the number of children per family. Therefore, the government should learn to adjust whether to restrict the number of children per family based on the specific circumstances of their country. Only by the practical situation can the policy be beneficial to the development of the country. So the government needs to think carefully before making a decision, whether it should control the number of children per family, so that it can promote the development of the country.",4.5,5,4.5,5,5,3.5
