Essays,Grammar,Lexical,Global Organization,Local Organization,Supporting Ideas,Holistic
"Family planning is the most effective way to solve the population problem, the seriousneof which we often underestimate. Quite obviously family planning has so far macle little progress. At a time when half of the world is suffering from starvation, poor health and a badly Iow standard of living, we simply cannot take lightly the population problem. If we don't control the birth rate right now we'll surely lead a miserable life in the near future.
llliteracy is perhaps the main enemy of family planning.Countries, which share the highest birth rate such as Brazil and India, are also those which share the highest illiteracy rate. People there don't even know what ""birth control"" is.
To me, the ignorance of family planning is a social problem. So we had better begin with social reforms through,say, legislation, etc. Of course, we cannot deny the necessity of the medical approach and we should use it in conjunction with other methods. The answer to the question whether man can survive one of the crises of the 21st century, namely population, is in our hands.
However,at present China's population is still growing very rapidly.It is reported that every year the population of this country increases by an extra 15 million and China is encountering a birth peak during the 1990s.It is abvious that China's economic development and improvement of people's living standards have been and will be greatly affected by the population.Therefore,to control population growth more strictly is clearly essential to the country's reforms and economic development.We should restrethe importance of birth control and call on the whole nation to make more effective actions .
",5.5,5.5,5.5,5,5.5,3
"Nowadays, there are more and more people on the earth. Among them, the number of people in China is the most. Do we have to let go and keep the number increasing? Absolutely impossible!
There are three main reasons why I support family planning. First of all, the land resources are limited. However, the people become more and more. The resources can't feed the people in the future. Besides, It's a burden for a family to have so many children. Maybe the children can't have a good education. Finally, I think people should be excellent not the number we have.
All in all, in my opinion the government should limit the number of children a family can have.
",4,4,5,4.5,5,3
"As we all know,china has a large population. For it's large area, the population has a great explosion. And it will be one big resistance for human rights.
First of all, like a football team, if this team have 30 teammates, it will be easier for the leader to lead the team. But when the team have over 30 teammates, that will become a trouble for the leader. So as our country, although we have a strong force to resist other countries, we don't promise every chinese people can use their rights properly. In my opinion, it's a good way that we must try our best to protect our rights. As a chinese, we have the duty to take this important task. What's more, if you don't want someone to break your rights, you'd must respect other's rights. Beside, when you find some people use their basic rights improperly,you can finger out that .
In a word, we must use our basic rights through a right way.
",4,4,4,5,4,3
"There are more and more people in the world, and in some countries, like Germany and China, having approving the Family planning policy to control the growing population. But is it suitable for a government to limit the number of children in a fimily? For my perspective,  it is a effective way to decrease the population since the increasing number of people has brought many dangers to our society and does no good to our further development .  
To begin with, we all know that the resource is limited. Like food, water, land. so the average portions would be decreased because of the large population. Take the housing price for example, recent years, the housing price has a sharply growth, especialy in Beijing, causing great pressure to young people, obviously, this is the result of the large pupolation. In some poor regions, the lack of living space is not the top problem, because they even have not solve the problem of food since there are too many people to feed, but the food is limited.
Moreover, the population boom also causes great harm to our environment . There are more pollution than before because a large number of people produce rubbish everyday. And the area of forest is decreasing because we need more wood . The number of river and lake are also reduced, because we need water to support our life. Alll these result in many ecological problems, like the extinction of species,  wate rand soil loss, and sand storm, to name but a few.
The growing population also  brought many serious social problems like robbery and traffic jam. It also make the government management become more difficult. 
To sum up , If the government does not do something to control the population, there will be many social dangers  and our human rights can not be fully guaranteed , so I think the government should play a positive role in the population problem.
",6.5,6.5,7.5,7,7,5
"As we know, family planning policy is a basic policy in our country. Some people think it is illogical because of the limitation of human rights but others think it logical because it limit the population explosion effectively!
In my opinion, the policy is correct and i support it! Imagine that if every family all have two children or more, our society and our globe would be what? It might be crowded, disordered and overloaded! Which may called population explosion, when it take place, the country muse be spend a lot money and time to deal with it! It will bother us and our later generations for a long time!
So, it is essential to limit the number of children a family can have, it also is the expression of protect human rights! Everyone should observe this rule! Thank you!
",4.5,4.5,5,5,4.5,3
"it's evidently that human's civilization has developed a long time. The human's rights has gained more and more attention, especially the basic rights. I think it's essential for the development of the human society. Only in this way , can we live a happy and steady life. On the other hand, we aren't supposed to abusing our rights. The use of rights must base on the law. If everybody contributes a little, our world will never be out of control.
if the population explosion is get to the maximum, the steady of the society is hard to keep. What's more, the stress in every direction will be more, such as working, studying and gaining money. Therefore, what we should do is to prevent the increasing of the population. Keep everything in order and live a more and more beautiful life.
",5.5,5.5,4,5.5,4.5,3.5
"As is known to us all, the population of a country is the basic of development. The increase of population can push forward the productivity of a country. But there are two sides of a coin, it is also a problem that have too many people.Because if the increase of population has over the development of the country, the basic human rights will be ignored. And at that time, the population will be a burden.
As a country which has the most population over the world, to solve this problem, the government make the law that there should be only one child that one family can have. It make progress for some years, but with time goes on, we have another problem that our people is going to be old which means that our population is decreasing. So the government relax policy respect, now things are getting better. On the contrary, The Indian has nearly the same population as us but they still encourage their people to give birth to more child. Because their population are decreasing all the time. The same situation also happen in Russia and many country. 
In my opinion, population is based on a country's strength and situation. If one can not afford its population, then they can not satisfied their people, and people will against the government. As it says: the right is the best.
",5,5.5,6,5,5.5,4
"With the development of human society, more and more people believe that people are born with equal rights so they realize that anyone of them has the right to pursue what they deserve to have. That leads to a question. It is reasonable for everyone to get their basic human rights, but does it proper on the point of human development?
In my view, all rights base on proper rules. One can't not get most of his basic human rights if he does not obey basic rules in human society.
Let's see a simple example. What if we abandon the rules that we are using to vote our president in China that only the ones voted have the right to vote for the senior leaders, but carry out a principle that everyone can directly vote for the president they support? I think it is a quite dangerous time for our country's policy. Because it is easier to win if the voter give an enthusiastic but not a wise speech. People's emotion decides the result. I mean, not all people have the ability to tell which voter has the better ability. So it is improper to give everyone the right to vote. And the principle is also suitable in some other sides.
On the other side, if one only considers about his own right but not show respect to other people's. It's impossible for others to take his rights serious,so they attack him. Then he loses his rights.
As what I said above, I think it is more reasonable to limit people's right with proper rules and principles. And the key to keep a balance between the basic human rights and the danger of population explosion is how to a set series of fair and proper rules.
",4.5,4,5,6,5,3
"In my opinion, a government doesn't have the right to limit the number of children a family can have.
As the government of a country, government should ensure the development of the country, as for which, just keeping the enhancement of the economy is not enough. It's also required controlling the number of the people of the country, because too many people will reduce the development of the economy.
Though the government have to solve this issue, they can't use the law to limit the number of children. On the one hand, the public has the freedom to decide how many children they will have, for which to use the law will make them unhappy. On the other hand, the law is used to protect the right and safety of the citizen, instead of to limit the right of the citizen. It will be better provided that the government can illustrate the advantage and disadvantage of having fewer children, to encourage the parents don't have too many children.
All in all, a government shouldn't be allowed to limit the number of children a family can have.
",5,4,5.5,5,4,3
"Human rights are equal while you are born and cry on the blue planet. I think it's a dream that we don't make. But it's going to be a truth toughly and smoothly. In spite of we don't be aware of it, it happens every where and every time during we live in the world. No matter what rights are shall be respected indeed. Happily, we have seen that many men and women stand up, and fight against the cruel culture and unfair life style. Actually we also see that someone who say that they fight with appropriate rights but ignore another group's rights to entertain and satisfy their giant desire.
I hope one day we can live with others equally and happily.
And the other discussion about population explosion, well, I have some idea about it. Indeed, our country have tasted a lot of candies that population brings to us. But now, we have faced the problems we made by ourselves.
First, the work opportunity is a big question, which bring us amount of no-work people and the lack of high-tech worker may lead to slowly producing speed.
Second, the living house is another question, we have to feed the people, we have to accommodate them to a nice living place, we have to build the surrounding completely and nice. OK, that's a big treasure.
Third, the crime is also a problem, we need safe place to live, it's basic and I think no one will not like it.
Now, problems have to be solved, and we need them solved.
",6.5,5.5,7,6.5,7,5
"As time goes by, there has been many years since the government put forward the issue of limiting the number of children a family can have. So, are the policies and regulations really right and do good to the development of our country? And does this method influence the basic rights of humans?
On the one hand, the family planning policy is necessary. Due to the huge popularity and limited place of our country, there will be little and little place for people to live, and the pressure of adults will be heavier and heavier, which must influence the development of country's economy and citizen's living standards. What's more, it has been a trend that a family has a child and most people has adopt to this condition. So if relive the limitation now, maybe many family would turn into a mess.
On the other hand, the limitation of control the birth of the second kid of a family should be proper. There's also many families who want one more child because they just want the house to be livelier and they will be more relaxed when they are old. Therefore, having two children is people's personal rights and the government should not disfranchise them.
From where I am stand, the family planning policy should executed continually, but it should be a little humanized.
",5,5.5,6,5,5,4
"In china, the number of children a family can have has been limited by the government, which made many families can only have one child, leading to the trouble of only child. Therefore, there is a big debate for whether a government should be allowed to limit the number of children a family can have.
As far as I'm concerned, the answer is yes. China has a large population which makes a build-up of pressure in many aspects, such as land, food and so on. Because of the limit, the population can grow slowly, which help avoiding the population explosion. What's more, on count of the system, we can get the good living conditions now.
May be someone considers this problem from basic human rights, thinking that it violates human rights. However, I believe the government will always make principle on balance, and we should undertake the due obligations as a Chinese.
",4.5,4.5,5,5,5,3.5
"As we all know, the Chinese Government made and started the policy of family planning many years ago and take it as one of our basic policies. This policy does solve China's population problem successfully, but in recent years, the disadvantage of the policy gradually appear.
The most obvious consequence is the rate of youth become lower and lower. In society terms, this make China gradually losing it's ability to develop economy in future increasing the cost to take care of the elders. And in family terms, the limit of number of children may lead to may make children feel lonely or be spoiled by their parents. This all bad for children's future. And beyond what I mention above, some people with power use their privilege to have more children, which make normal people feel unfair. Having and bringing up children is people's nature and this nature is not different from having data, marriage or divorce. Since people have rights to decide these things by themselves, why they can't decide how many children they have. 
But with the traditional of ""More children, more happiness"", the population problem must be take into consideration. So, in my point of view, the government shouldn't be given the power to limit how many children a family have but they do should take some methods to guide or tell the couples how many children should a family better have in current country's or global condition. If a family follow the government's guide to have children with proper number, the government should give them some award in order to courage other families. In this way people can have the freedom to give birth to baby and the population problem can be solved in some degree as well.
",7,6,5.5,6,6,4
"In my opinion, the government should not limit the number of children a family can have.
Although it has the right and responsibility to take citzens safety of human right and theirs property into considerationwhether to have and how to raise a child are not including in their brochures of responsibility. What they should think about is how to provide more welfare and regulations promising those families which have two or more kids run smoothly which is the same that they edit the layer to support some factories.
It is right for the government to imagine what the future will be, population explosion, pollution, global temperature and so on. There are so much problems, and I believe almost every government in the world are take every effort attempting to solve them, whether for the fame or their citzens. But the most significant problem in this question is that human multiple because their need in psychology and body. We can not take control of a natural process. Once we take some means to depress those requriments, the bad effect will come out of the level of the sea. When the government decide to loose the control of birthing, they discover more than half of the family are not going to raise a child, in which case, a aging society come to us.
Maybe we can learn from a fairy story - how the leader of a tribe called Dayu curb the flooding. Chinese acient wisdom tells us it depending on dredging instead of blocking. My suggestion is that the government should promote the spread of right bearing concept. The government has the right of guiding instead of control. Education is the best way to solve this problem, especially people of the day have higher education level.

",6,7,5.5,5.5,6,4
"Should a government be allowed to limit the number of children a family can have?


With the economy developing rapidly and peoples living standard increasing remarkably, the government introduced a new policy called Two-child Policy recently, which has caused a fierce debate about whether a government is allowed to limit the number of children a family can have.
  Some people support the government, concerned about the danger of population explosion. If there wasnt the Birth control policy, China would be full of people now, and not being hungry would be a serious problem. While others, maybe people who loves children, think it in another way, claiming that having children is one of the basic human rights, and the government has no reason to deprive their reasonable right.
  Every coin has two sides, so does the policy. In my opinion, the policys merits outweigh its short-comings, and the government should limit the number of new-borns at present in China. First, I think humans should be not only feed, but also educated. If the population is large, there wouldnt be enough education resources. However, China is face with an extremely negative situation nowthe aging population. As a result, the governments new Two-child Policy remits this situation to some degree, which at the same time cares for human rights. 
",6,6,5,5,4.5,4
"It is certainly very understandable that some governments should start looking at ways of limiting their populations to a sustainable figure. In the past, populations were partly regulated by frequent war and widespread disease, but in recent years the effects of those factors have been diminished. The first fifty years of the next millennium will be critical for the world's population. By 2050, population growth should have leveled off, but by then we'll have 10 billion people, which is two thirds as many as we have today. The rate of population growth is something we can choose right now, a matter of human choice. The choice is a complicated one, with many variables, but it remains a choice.
If we want to prevent a population explosion, we should take action now -or assist the poorer countries to do so. They need better government, better institutions, better labor and capital markets, better schools.
Anything that increases the value of women's time and adds to the cost of caring for a child makes a woman less likely to have that child. Since big families are often seen as safety nets for illness and old age, improving poor people's access to insurance, pensions and welfare institutions also has a major impact. This can be as simple as rural credit, providing a means of saving. Finally, there is education--both for women and, perhaps even more important, for the next generation of children.
These steps are there to be taken, but there appear to be some countries that are not seriously trying at the moment. If we cannot achieve that we will certainly not control population.
That said, I don't feel pessimistic that we are going to run out of resources: we are becoming more efficient at producing food faster than the rate at which population is increasing. There is, however, a risk that we will wreck the environment so effectively that the world will no longer be an attractive place to live. That really would be a dismal outcome, to reach world population equilibrium only to find we'd destroyed the natural environment in the process.

",6,6.5,5.5,5.5,6,4
"Should a government be allowed to limit the number of children a family can have?

There are more than 6 billion people on the earth now. About one fifth of the total population is Chinese. And it is known to us that the number of Chinese have limited by the Chinese population policy for several decades. It may be quite different without the population policy that the Chinese government published today. Allowing the government to limit the number of children a family can have which is a matter of primary importance.
The area of the land of China measures 9.6 million square kilometers and some areas of China dont have the living condition. To Chinese, almost every city is crowded now such as Beijing. It hardly to imagine that if there are more people in those cities. Chinas total population is 1.375 billion in 2015. Many problem comes up with large population. Pollution, unemployment, nature recourses, traffic, etc. are the problem that cause by large population and we have to be faced with. 
We can imagine what our country would be like if the population policy didnt publish by our government. Maybe people can sit on the top of the train like Indian when you travel to another province. More city would be located in the land of China which means the decrease of forests, lake and farmland. When people go shopping they have to spend more time on waiting. And it hard for China to become the largest financial country in the world. The lack of job is not only for college students but also for master students and even doctoral students.
Absolutely, if every parent of each family can think of more about the influence of the population and prefer to devote into the work of construct more attractive country than ride another child, it will never need the governments limitation.

",7,4.5,6,5,7,4
"Assignment
Should a government be allowed to limlt the number of children a family can have? Yes, I think the government should be allowed.With the improvement of life standard and medical condition,peoples death rate declined and the average life span increased.If we dont allowed the government to limit the fertility rate,people themselves wont do that.This must lead to population explosion in our limited earth.
As we all know,population explosion is not a good thing for us.First of all,when the number of people increase,the demand for food will become more and more.However,because of the use of chemical fertilizer,the organic material in soil have been damaged.Land impoverishment and desertization happened.At the same time,a geat deal of plowland have been occupied.It becomes more difficult for us to increase the grain output.So,when population explosion happened,the first basic problem we have to face is food crisis.Then a series of chain reactions will happen.Once one year have a poor crop,famine will come rapidly especially in the development countries.To some degree,though famine wont happen and people can live from hand to mouth,food shortage can still lead to many malnourished people.This condition may intensified unemployment and poverty.
Except food crisis,population explosion can also result in resource and zoology crisis.The resource in our planet is limited and the environment capacity is limited too.When more and more people live in the earth,the resourse and environment which every owns will become less and less.When conflict of interest happened between people and people,the contraditions between country and country or region and region will exacerbate.Then all the world will be in turmoil.This is horrible.
If the government dont limit the number of children a family can have,we can imagine that ,one day,people have to live in a building having 2000 floors.At this time sunlight may become a kind of luxuries.People not live in paradise but in a big prision.
As far as Im concerned,that the government limit the number of children a family can have is to assure the basic human rights better.Therefore,I hold the belief that a government should be allowed to limit the number of children a family can have.
",7,6.5,8,8,7,5
