Essays,Grammar,Lexical,Global Organization,Local Organization,Supporting Ideas,Holistic
"Talking about the problem of limiting of the number of children a family by government,in a big picture,I agree with it absolutely.The reasons why I think so are followed.
Basing on human rights,this behavior should be condemned.Whether we decide to have one more child should be decided by our own will,which couldnt change by anybody except ourselves.The child is a crystallization of love,symbolizing a beauty and pure love of human relationship,and anybody have the right to create a new life with their partner without any limit,even the government.Besides,a  abandon of human right is out of social morality,which should cast aside without any mercy.Everyone has the right to make a decision on creating a new life symbolizing love.
However, basing on the influence of population explosion,a government should be allowed to limit the number of children a family can have.As we all known,the  born explosion will change the social age structure into more percentage of older people who lose the working ability so that they need the government supporting to make a live and new baby,which means there is lower percentage of labour making money for the whole society.Moreover,the increasing of population will heavier the burden of amounts of working positions.When the limited working position couldnt meet the need of increasing of family with children,more children couldnt be afford to a education and living level they deserve to support their growth.That might lead to a low level of new generation which couldnt take the burden of our society to take a new step in human development progress,and its possible a negative circling.
To make a long story short,a government should limit the number of children a family can have.The limiting is a violation of human right,though this behavior will make more family and their children to live a life in a higher level and benefit to our society development.

",6,5.5,5,5,5,4
"Should a government be allowed to limit the number of children a family can have?
  I dont think a government should limit the number of children a family can have.Person will inevitably encounter some diseases, accidents such as natural calamities and man-made misfortunes. However,if a government limit the number of children a family can have,then a family only have a child.The departure of a young one, is a complete breakdown of a family.And the parents are desperate for life.
  And I think,the right to procreate is the basic right of a person.I don't think the government should use political methods to limit people's right to procreate.A family of three looks happy and stable, but there is always a hidden danger. What kind of family would this family be if the only child suddenly had an accident? What kind of life will parents face?The kind of family,not only brings great pain to the individual, but also brings great impact to the society and the country, whether it is economic or national strength and the future development.
  When the one child policy was carried out 30 years ago, it said that after 30 years the intense increasing population would be slow down, and then a new population policy would be needed. Actually, the population was well-controlled during these 30 years. At the same time, the elderly population surges quickly. Thanks to the Family Planning Policy, it took China only 27 years to complete this process. Our process goes too fast that it caused many problems. So we need flexible policy to deal with the birth of the second child.
  In my opinion,for our country, one-child policy has out of date.And the new policy is needed and necessary.Maybe It can solve the problem of nowadays and the future.
",6.5,5,6.5,6,5,4
"   Now the population on the earth has become larger and lager and even has changed into a big problem, which everyone has to face and are difficult to deal with.
   In this situation, I think a government should be allowed to limit the number of children a family have. Take my hometown as an example. I was born in only one-child period. In that period, Chinese government had a firm attitude and took active actions to carry the one-child policy. Why did these with so great energy? Consider of the development in the future and better life of Chinese people. Too many people is certain to hinder the development of economy and the whole society just like forecasting.
   Population explosion will become a great disaster the whole people. As we can see in the disaster film, so many people live together on the earth. However, there are only limited resources and living space. Then there are many people ,who is lack of food ,water and other necessities, even to die. And the population explosion maybe lead to conflicts among different nations, countries or religions ,and even lead to destructive wars.
   Of course, the governments should take scientific and appropriate ways to limit the population. For example, the government should take consideration of the human rights. In the process, there are many sensitive problems worth our attention. For the government should respect the customs of different religions and regard human rights as the first key. For people ,the governments maybe provide them with more opportunities to learn more knowledge about population explosion and make them obey and support the policy consciously.
  In conclusion, limiting the population is necessary for the luck of the whole human-beings. The governments should take the appropriate ways to solve these problems and improve our life.
    
",4.5,5,5.5,6,6,4
"Should a government be allowed to limit the number of children a family can have?

Today, many children are the only child in their family because of the goverments birth control.Not like their parents,they dont have brothers or sisters.And when they grow up,they have to work hard to feed a family .But does that policy kill basic human rights? In some degree,it really does.But it also protect the quality of life.
In China ,the government carrys out the only child policy.While in some developed countries,their governments encourge people to give birth to more children.The governments policy is based on the condition of the country. And what the government does is try to improve national conditions as well as the quality of peoples life. Just list China as an example,China began to carry out family planning in full swing in 1971, bringing China's total fertility rate from 5.8 in 1970 to 2.24 in 1980, close to the world's advanced level.It also allows China to develop rapidly .There is also a negative example-India.Indias government doesnt control the number of children.limited goods are divided to a large number of people,so each one has just a little.This has led to backwardness and overall poverty in India.It is obvious that without population control, the wanton development of the population will certainly increase the burden on the nation's economy and reduce people's happiness.
So the government doesnt kill the basic human rights,but gives you more possibility to live more happier. The policy reduces mortality and makes sure everyone has enough resources.Now, the Chinese government has formulated a new population policy according to its national conditions.It is believed that such a policy will lead to further development of China and a better environment for people to live in.

",5,5,6.5,6,7.5,4.5
"The family planning policy was put forward by the Chinese government in the last century to curb the excessive growth of China's population. After thirty years of implementation, China's population birth rate has been greatly reduced. But it also brings a lot of new social problems.
The United Nations statistics show that China's aging rate is the fastest in the world. The aging of our population is not only the speed of the fastest, and the trend of ageing population is more than the development speed of national economic and social modernization of our society. The population is in the stage of rapid economic development, the per capita income level is low, the comprehensive national strength is not strong, the premise of the social security system is not sound. This kind of situation is opposite to the developed country's aging, and the developed country's population is aging and the industrialization of chemical industry has been completed, and the economy has reached a high level of development. In addition, China's population aging still has the characteristics of regional imbalance. The degree of aging in various regions in China has increased from west to East, and the gap between the regions is relatively large. In the eastern coastal areas, the proportion of elderly people over the age of 65 has exceeded 8%, with Shanghai reaching 11.46%. The proportion of the elderly population in the western region is below 5%, and some areas are still typical of the younger population structure. The difference in the degree of aging has further exacerbated the imbalance in regional economic development. Therefore, the problem of aging is not just a population problem, but it has also become a problem restricting economic and social development. For these reasons, a change of family planning policy is beneficial to the development of the country.
",5,8,5,6,6,4.5
"Our country is a country of large population. So I think the government should limit the number of children in a family. And family planning is the most effective way to solve the population problem, the seriousness of which we often underestimate. Quite obviously family planning play a great role in the development of our country.
At a time when half of the world is suffering from starvation, poor health and a badly low standard of living, we simply cannot take lightly the population problem. If we dont control the birth rate right now well surely lead a miserable life in the near future. illiteracy is perhaps the main enemy of family planning. Countries, which share the highest birth rate such as Brazil and India, are also those which share the highest illiteracy rate. People there dont even know what ""birth control"" is. To me, the ignorance of family planning is a social problem. So we had better begin with social reforms through, say, legislation, etc. Of course, we cannot deny the necessity of the medical approach and we should use it in conjunction with other methods.
  But the family planning is not a plan that never changes. With the time goes by, 1 child in a family is not a good idea for a family and our country. The society needs energy to develop. So two children is the best idea now. only we control the plan in a good way, can we have a good result at population problem.


",4,5.5,5.5,4,5,3
"Recently,there is a topic becaming popular among the crowed.Should the government be allowed to limit the number of children a family can have?Someone insists that the family should have the rights to decide the number of children,while there also are a part of people think that the government should limit the number of children a family can have.As far as I am concerned,the family should have the rights to have more children but at the same time, the government should limit the number.
First of all,I want to mention that I am the only child of my family.So with my experience as the only child of my family,I can say ,there are advantages and disadvantage compared to the family who have more children.For example,I can have my own stuffs and place in my home not like the children home.The children have to share with the bed,the toys,the computer etc.Maybe this point will make the child become more selfish than others,which becomes the normal social reality in this ages.Maybe the only child could have their own stuffs,but the children are growing up together,During this time, they learned and play together.Whatever things they want to do ,there will not be alone.Its obvious that the one child will lose many joy at the age of children.When it comes to the festival,everyone like to stay in the place where is full of people.Think about the one-child-family there are just three person at home.As the only child of my family,I will feel lonely in every Sping Festival.
However,the more children the family have does not mean the more joy the family will gain.let me take the Arican countries for instance.As we all know ,there are less policy to limit the number of children the family can have in African countries,so we can see there are many big family who has many children in African countries.But most of them are not rich enough to raise so many children at the same time.Even some families can not feed their children.In this situation, the number of children bring more stress to the family.Even worse,some families are too poor to afford the fees of raising a child,which makes the child starve to death.
   From the above of all,we can see the advantages and disadvantages clearly.We can tell the number of children should depend on the family.The family should have the rights to decide the number of their children.Anyway ,it also should depend on the environment.The family must decide how many children they can raise to decide how many they want.In addition, the government should play an important part to control the population of the country .Based on this,the government had better take some proper measures to control the population.In the mean while, the families should follow the policy the government made to make decisions. 
 
",5,6,6,6.5,5.5,4
"Up to now, it is reported that the number of population in China has reached more than 1.4 billion. Regarding to the explosion of population in China, I think government should control the number of children a family can have. 
As far as I am concerned, there are 3 main reasons that can hold my point. One is that though our country is the third largest country in the world, the average, whose whole land is divided by 1.4 billion, is way too little. We should control the number of children to upgrade our life quality and remaining social rights. Our public construction has overloaded for years. Everyone can not get enough what they want. We should reduce population to get our rights. Second is that by limiting the children's number, a family could save more time to look after their only one or two babies instead of figuring out when to take care their second child, when to take care their third child. As for the kids, they can have more time to spend with their parents equally and happily, without jealousy. Last but not least, the trend of aging population is one of the greatest impact to our country, right now, we should focus on that problem. The limitation on kids is not the most urgent one. We can have this debate, but this is not the most suitable time.
Though the limitation on children birth has many weak problems, we can't deny that this policy has made many great efforts to our society, gradually, turning a rude, weak country into a progressive and polite one. There is no such thing can always have good effects, without bad ones. I think the time would prove that this decision for now, is the best decision for our country. I believe ,when the time comes, a family can have more kids than two,which is not the right decision for now.

",7,5,6,6,6,4
"Never should a government has the right to limit the number of children of a family, its definitely a violation to basic human rights .Government gets the power from people, and every policy should be good to human rights not offensive. Some reminds us of the danger of population explosion, which can cause the consumption of resources and damage the basement of our society. However, I think it is not a wise idea to limit the number of children by carrying out some rules and bans. Those rules can never solve the problem eventually, and look like to violate basic human right  the right to have children. And this thought ignore the benefit of humans. With more people ,we can create more social wealth and make our world a better place where People can develop naturally and freely. Last century, chinas government carried out a policy called one child policy ,which means that one family both in city and country can have only one child. If a family want to have a second child , they must get permission and pay for the childs social costs. In some places, mothers pregnant were forced to miscarry her child. We can read Moyans famous novel <<frog>> and learn something about this policy. 10 years passed , the policy have been proved to be successful, the rate of new-born children decreased sharply in China. But it brings one problem :the whole society becomes older, lacking work force to maintain social functioning.And the society agrees that 80s, 90s generation have too much burden. They come to realize the negative result of one-child policy, so the government have to encourage family to have more than two kids. Looking back the history, we know that its never a good idea to let the government limit the number of children of a family. But we must know that having too many children is not good for a family , either. its better to give a guidance to public in accordance  with reality of the family and country. At last, I think of the famous saying: we hold these truth to be self-evident that all man are created equal, that they are endowed by their creators with certain unalienable rights, that among these are life , liberty and pursuit of happiness.




",4.5,5,4,5,4.5,3
"It's an obligation to the government to regulate the population for the benefit of a country's development. The substance of 'one child police' and the one encouraging birth are the same, actually. For example, China in the 1980s punished the families that have too many children to limit the population and Russia today levies couples without children high taxes to encourage birth. Huge population will be a heavy burden of resources, energy, education and safety, which slows the stride of social development and triggers unfair social treatment because of the heavy load. Small population usually limit the labor, produce, community and economy, which also slows the stride of social development because of the lack of energy. The aim of these two different polices are both adjusting the population in a appropriate scale. 

Whether regulating the population by forcing people to raise children or not concerning human rights indeed. But the discussion of human rights should be based on the culture background. In the culture of community oriented, it's logical to follow the rational command of society. But in the one which is individual oriented, forcing someone to have children or raise only one child may conflict with his will. People in individual-oriented culture look like more selfish and people in community-oriented culture look like more compliant. Up to now, no government can keep the balance between absolute human rights and national policies successfully because the benefit conflicts always exist in the individual and community inevitably. Whether the policies protect human rights or not only can be judged by native people.

",6,6,4,5,5,4
"Not too long ago, the government opened the second child policy, which causing social heated debate. Thus, should government be allowed to limit the number of children a family can have has been turned into hot topic by people.
Well, on my own perspective, the answer is Yes.
In macroscopic view,our country, with a large population, puts Planned Parenthood into practice, which to a great extent restrained the growth of population.
This policy plays a positive role in reducing the pressure on many aspects by reducing the population growth. Such as resources, traffic, housing and job. Effective mitigation and adaptation in population growth can lead our country take the global challenge better and be a powerful country.
In Microscopically view,the policy also takes an active role.
First of all, lighten the family economical burden, especially in big cities. Therefore, parents can provide more high-quality education and so on.
Second,It is helpful for the development of children. Because parents can take more time and energy to bring up their children. And children will get more love and better resource in nearly all aspects.
In conclusion, I hold the view in government should be allowed to limit the number of children a family can have has been turned into hot topic by people.




",3,4.5,5,4,4.5,3
"The population in the world is increasing rapidly with the improvement of medical condition. In my opinion, a government should be allowed to limit the number of children a family can have, which actually is an effective policy to avoid the danger of population explosion.
As we all know, lots of problems will be brought with the rise of population. Food, water and even places where people live may be not enough for the whole world. And then there will be many wars about fighting for foods and other resources. Could human race live in such a riot? Besides, it is hard to imagine that after the war how many people would survive and if they still had the power to get over what would happen next and built a place comfortable enough for them to live with happiness.
However, the effective way to controlling the number of people may encroach human rights. In the history, usually, it is the family that decides on how many children they would have. And only a government respect the rights people have can the government has the faith of people to lead the country.
When you face with problems, you should look into it rather than see it in the surface. The influence of population explosion and the encroachment of human rights are the two problems come up from the limit of children number, which are the same questions as the future of human and the basic rights of human. Which one would you like to choose? 
",5,6,5.5,5.5,5,4
"China is a great country with the largest population in the world. In order to solve the population problem, our government decides to implemented one-child policy. When it is carried out for some time, many people not only see its advantages but also disadvantages. Thus, people argue that two-child policy should be put into effect. In my opinion, two-child policy should be carried out.
First of all, two-child policy is the gift for some only child. For some families, maybe the parents are only child and they also can have only child. Put aside the loneliness of their child, when their child grows up and they grow older, their child marry with an only child girl accidentally, the burden on their child and his wife is unimaginable heavy. Their child and his wife have to take care of two old couples. Usually, a young couple looking after an old couple is a little difficult; if the pressure increasing twice, how can they stand it. But if their parents have two children, they can share the burden of taking care of their parents. It would be much better.
Secondly, two-child policy can guarantee the number of Chinese population. As the widely spread of one-child policy, some people have changed their conception about giving birth. If they firmly believe one-child policy, there will be more and more the dink. After several decades, our country will famous for lack of population.
In conclusion, one-child policy has out of date. And tow-child policy is needed and necessary. It can solve the problem of nowadays and the future
",4,5.5,5.5,4.5,5,3
"Seeing the topic my first reaction was answer is noof courseBecause I just thought the statutory regulation is in violation of human rights to carry on the family line. But, as I read the question more carefullyfinding that limit the number of children a family can have doesn't mean we can not have baby but we cant give birth indiscriminately I feel so sorry for how perfunctory I was.
       I started to wonder why the government want to set the regulation. The most Intuitional reason is that the population is overflowing in not only China but the whole world. And this is a significant problem needed to be solved. To solve it is too hard but to slow it down from now is necessary. I also find reasons in a deep way. That limit the number of children a family can have is expressing respect to livesespecially to those new lives.
       Follow my line of thinkingwhen we know the regulation is right there what would we doWell be more cautious every time we want to have a baby of our own. Well start to consider it early or lateright or wrongthis and that just to make sure this baby is priceless for us because chance is precious and the number is limited.

",4,5.5,4,4.5,4,3
